{"format":"meridian.indigenous","version":"v1","caveat":"Derived from modern language distribution and linguistic records; not pre-contact boundaries.","families":[{"code":1,"glottocode":"algi1248","glottologName":"Algic","label":"Algonquian"},{"code":2,"glottocode":"atha1245","glottologName":"Athabaskan-Eyak-Tlingit","label":"Dene (Athabaskan) and Tlingit"},{"code":3,"glottocode":"eski1264","glottologName":"Eskimo-Aleut","label":"Inuit"},{"code":4,"glottocode":"haid1248","glottologName":"Haida","label":"Haida"},{"code":5,"glottocode":"iroq1247","glottologName":"Iroquoian","label":"Iroquoian"},{"code":6,"glottocode":"kute1249","glottologName":"Kutenai","label":"Ktunaxa"},{"code":7,"glottocode":"sali1255","glottologName":"Salishan","label":"Salish"},{"code":8,"glottocode":"siou1252","glottologName":"Siouan","label":"Siouan"},{"code":9,"glottocode":"tsim1258","glottologName":"Tsimshian","label":"Tsimshianic"},{"code":10,"glottocode":"waka1280","glottologName":"Wakashan","label":"Wakashan"},{"code":11,"glottocode":"beot1247","glottologName":"Beothuk","label":"Beothuk"}],"areas":[{"family":1,"source":"census","confidence":0.7,"cells":1373,"geometryRef":"family_1_census","labelPoint":[-113.4573,53.6287]},{"family":1,"source":"glottolog","confidence":0.3,"cells":12995,"geometryRef":"family_1_glottolog","labelPoint":[-71.5176,51.9359]},{"family":2,"source":"census","confidence":0.7,"cells":164,"geometryRef":"family_2_census","labelPoint":[-122.2139,52.1806]},{"family":2,"source":"glottolog","confidence":0.3,"cells":11764,"geometryRef":"family_2_glottolog","labelPoint":[-121.7312,62.4312]},{"family":3,"source":"census","confidence":0.7,"cells":111,"geometryRef":"family_3_census","labelPoint":[-75.687,45.3016]},{"family":3,"source":"glottolog","confidence":0.3,"cells":8801,"geometryRef":"family_3_glottolog","labelPoint":[-96.5433,66.1572]},{"family":4,"source":"census","confidence":0.7,"cells":2,"geometryRef":"family_4_census","labelPoint":[-132.0906,54.004]},{"family":4,"source":"glottolog","confidence":0.3,"cells":67,"geometryRef":"family_4_glottolog","labelPoint":[-132.3282,53.7878]},{"family":5,"source":"census","confidence":0.7,"cells":18,"geometryRef":"family_5_census","labelPoint":[-74.6682,45.185]},{"family":5,"source":"glottolog","confidence":0.3,"cells":139,"geometryRef":"family_5_glottolog","labelPoint":[-72.5902,45.4367]},{"family":6,"source":"census","confidence":0.7,"cells":4,"geometryRef":"family_6_census","labelPoint":[-115.8932,50.4561]},{"family":6,"source":"glottolog","confidence":0.3,"cells":89,"geometryRef":"family_6_glottolog","labelPoint":[-115.0869,49.616]},{"family":7,"source":"census","confidence":0.7,"cells":65,"geometryRef":"family_7_census","labelPoint":[-119.405,50.6272]},{"family":7,"source":"glottolog","confidence":0.3,"cells":931,"geometryRef":"family_7_glottolog","labelPoint":[-118.5933,51.1562]},{"family":8,"source":"census","confidence":0.7,"cells":15,"geometryRef":"family_8_census","labelPoint":[-100.2009,50.0231]},{"family":8,"source":"glottolog","confidence":0.3,"cells":767,"geometryRef":"family_8_glottolog","labelPoint":[-116.4491,52.2742]},{"family":9,"source":"census","confidence":0.7,"cells":26,"geometryRef":"family_9_census","labelPoint":[-128.1727,55.1474]},{"family":9,"source":"glottolog","confidence":0.3,"cells":206,"geometryRef":"family_9_glottolog","labelPoint":[-129.1639,54.9667]},{"family":10,"source":"census","confidence":0.7,"cells":31,"geometryRef":"family_10_census","labelPoint":[-124.7384,49.2587]},{"family":10,"source":"glottolog","confidence":0.3,"cells":352,"geometryRef":"family_10_glottolog","labelPoint":[-127.9569,54.1008]},{"family":11,"source":"glottolog","confidence":0.3,"cells":512,"geometryRef":"family_11_glottolog","labelPoint":[-55.8732,48.971]}],"communities":[{"id":2030,"name":"Iqaluit","people":"inuit","lng":-68.52167,"lat":63.74944},{"id":123033,"name":"Tsuut'ina Nation","people":"first_nation","lng":-114.35,"lat":50.96667},{"id":201351,"name":"Clyde River","people":"inuit","lng":-68.5861,"lat":70.4739},{"id":276115,"name":"Grise Fiord","people":"inuit","lng":-82.89389,"lat":76.4175},{"id":284160,"name":"Kimmirut","people":"inuit","lng":-69.8686,"lat":62.8467},{"id":321535,"name":"Abitibiwinni First Nation","people":"first_nation","lng":-78.11667,"lat":48.6},{"id":338686,"name":"Inuvik","people":"inuit","lng":-133.73056,"lat":68.36167},{"id":368114,"name":"Michipicoten First Nation","people":"first_nation","lng":-84.92716,"lat":47.96116},{"id":374966,"name":"Eel Ground First Nation","people":"first_nation","lng":-65.6273,"lat":46.9692},{"id":402605,"name":"Ahousaht First Nation","people":"first_nation","lng":-126.05609,"lat":49.27806},{"id":420187,"name":"Aklavik","people":"inuit","lng":-135.012,"lat":68.2203},{"id":423720,"name":"Akulivik","people":"inuit","lng":-78.2,"lat":60.8},{"id":465235,"name":"Paulatuk","people":"inuit","lng":-124.069,"lat":69.3514},{"id":475072,"name":"Quatsino First Nation","people":"first_nation","lng":-127.57128,"lat":50.61409},{"id":485070,"name":"Siksika Nation","people":"first_nation","lng":-112.906,"lat":50.803},{"id":595958,"name":"Tsawwassen First Nation","people":"first_nation","lng":-123.09757,"lat":49.03752},{"id":606622,"name":"Resolute","people":"inuit","lng":-94.83222,"lat":74.6975},{"id":631747,"name":"Pangnirtung","people":"inuit","lng":-65.6994,"lat":66.1478},{"id":638017,"name":"Arctic Bay","people":"inuit","lng":-85.1525,"lat":73.0364},{"id":642458,"name":"Kugaaruk","people":"inuit","lng":-89.8267,"lat":68.5331},{"id":643346,"name":"Arviat","people":"inuit","lng":-94.063,"lat":61.108},{"id":652770,"name":"Coral Harbour","people":"inuit","lng":-83.16417,"lat":64.13694},{"id":665280,"name":"Kinngait","people":"inuit","lng":-76.54167,"lat":64.23333},{"id":718822,"name":"Ulukhaktok","people":"inuit","lng":-117.768,"lat":70.7364},{"id":719379,"name":"Sachs Harbour","people":"inuit","lng":-125.248,"lat":71.9856},{"id":719547,"name":"Tuktoyaktuk","people":"inuit","lng":-133.031,"lat":69.4428},{"id":719585,"name":"Gjoa Haven","people":"inuit","lng":-95.86667,"lat":68.63333},{"id":719605,"name":"Taloyoak","people":"inuit","lng":-93.5267,"lat":69.5369},{"id":719611,"name":"Cambridge Bay","people":"inuit","lng":-105.05306,"lat":69.11722},{"id":720333,"name":"Umingmaktok","people":"inuit","lng":-107.924,"lat":67.6989},{"id":736679,"name":"Popkum First Nation","people":"first_nation","lng":-121.71946,"lat":49.20193},{"id":778269,"name":"Little Salmon/Carmacks First Nation","people":"first_nation","lng":-136.28886,"lat":62.09617},{"id":804378,"name":"Baker Lake","people":"inuit","lng":-96.02083,"lat":64.31944},{"id":814008,"name":"Scia'new First Nation","people":"first_nation","lng":-123.60772,"lat":48.33726},{"id":930650,"name":"Carcross/Tagish First Nation","people":"first_nation","lng":-134.70376,"lat":60.17044},{"id":939231,"name":"Sanikiluaq","people":"inuit","lng":-79.225,"lat":56.5428},{"id":966023,"name":"Kangiqsualujjuaq","people":"inuit","lng":-65.95278,"lat":58.69433},{"id":991143,"name":"Inukjuak","people":"inuit","lng":-78.1,"lat":58.45},{"id":991147,"name":"Kangirsuk","people":"inuit","lng":-70.0278,"lat":60.0181},{"id":991497,"name":"Kangiqsujuaq","people":"inuit","lng":-71.9667,"lat":61.6},{"id":999339,"name":"Igloolik","people":"inuit","lng":-81.7994,"lat":69.3761},{"id":1002024,"name":"Buffalo Point First Nation","people":"first_nation","lng":-95.2617,"lat":49.0164},{"id":1012728,"name":"Puvirnituq","people":"inuit","lng":-77.28333,"lat":60.03333},{"id":1013360,"name":"Ivujivik","people":"inuit","lng":-77.9083,"lat":62.4167},{"id":1016847,"name":"Esgenoopetitj First Nation","people":"first_nation","lng":-65.1482,"lat":47.1979},{"id":1016901,"name":"Tsleil-Waututh First Nation","people":"first_nation","lng":-122.98787,"lat":49.31062},{"id":1021766,"name":"Rankin Inlet","people":"inuit","lng":-92.11583,"lat":62.81139},{"id":1061084,"name":"Champagne and Aishihik First Nations","people":"first_nation","lng":-137.50639,"lat":60.7525},{"id":1069178,"name":"Stz'uminus First Nation","people":"first_nation","lng":-123.77211,"lat":48.99302},{"id":1070783,"name":"Chesterfield Inlet","people":"inuit","lng":-90.7061,"lat":63.3408},{"id":1107797,"name":"Cold Lake First Nations","people":"first_nation","lng":-110.2657,"lat":54.381},{"id":1137610,"name":"First Nation of Nacho Nyak Dun","people":"first_nation","lng":-135.89722,"lat":63.59472},{"id":1167192,"name":"Hesquiaht First Nation","people":"first_nation","lng":-126.27209,"lat":49.36836},{"id":1230294,"name":"Ditidaht First Nation","people":"first_nation","lng":-124.6697,"lat":48.80928},{"id":1268420,"name":"Nuxalk Nation","people":"first_nation","lng":-126.7157,"lat":52.3619},{"id":1299238,"name":"Ehattesaht First Nation","people":"first_nation","lng":-126.85899,"lat":49.98515},{"id":1370641,"name":"Qikiqtarjuaq","people":"inuit","lng":-64.0247,"lat":67.5581},{"id":1377345,"name":"York Factory First Nation","people":"first_nation","lng":-96.1017,"lat":56.0889},{"id":1399552,"name":"Liard First Nation","people":"first_nation","lng":-128.71655,"lat":60.06602},{"id":1437762,"name":"Lyackson First Nation","people":"first_nation","lng":-123.64327,"lat":49.04211},{"id":1468698,"name":"Tr’ondëk Hwëch’in First Nation","people":"first_nation","lng":-139.437,"lat":64.0944},{"id":1484054,"name":"Mishkeegogamang First Nation","people":"first_nation","lng":-90.2731,"lat":51.065},{"id":1497871,"name":"Bearskin Lake First Nation","people":"first_nation","lng":-90.96944,"lat":53.92472},{"id":1520098,"name":"Kainai Nation","people":"first_nation","lng":-113.3012,"lat":49.4627},{"id":1529007,"name":"Hollow Water First Nation","people":"first_nation","lng":-96.3019,"lat":51.1925},{"id":1543830,"name":"Kuujjuaq","people":"inuit","lng":-68.3986,"lat":58.1067},{"id":1565644,"name":"Tla-o-qui-aht First Nation","people":"first_nation","lng":-125.91207,"lat":49.17335},{"id":1570220,"name":"Halalt First Nation","people":"first_nation","lng":-123.69612,"lat":48.874},{"id":1571291,"na